Service ID,Service,Organisation(s),Location(s),Service Type,Free,URL,Timing notes,OnePlanet Cats,Audience Cats,Use Cases,Basic type,Homeless Only,Disability Only,Children/Parents Only,Members Only,Referrals Only,Description
SRV045,Hawkinge Community Fridge,Folkestone Community Fridge,Hawkinge Community Centre,Regular event,TRUE,https://folkestonecommunityfridge.com/6/,11am-1pm Every 2nd Sunday of the month,No food poverty,All,"save-money, reduce-waste, free-food",Food service,FALSE,FALSE,FALSE,FALSE,FALSE,Monthly pop-up community fridge at the Hawkinge Community Centre run by Folkestone Community Fridge.
SRV046,Charivari Day,Strange Cargo,Folkestone Town Centre,Seasonal event,TRUE,https://www.strangecargo.org.uk/,Annual (Summer),Festivals and events,All,free-activities,Outdoor activities,FALSE,FALSE,FALSE,FALSE,FALSE,"Charivari Day is an annual summer carnival that takes to the streets of Folkestone to celebrate a different yearly theme.

A vibrant procession of 800 plus people including bands, dancers and giant carnival builds parade from Folkestone’s historic Stade, to the Leas band stand via the Old High Street and town centre."
SRV047,Walk and Talk,Folkestone Fellas,,Regular event,TRUE,https://folkestonefellas.com/,Check org sites for upcoming dates,Emotional wellbeing,All adults,meet-people,Tea & talk,FALSE,FALSE,FALSE,FALSE,FALSE,Monthly Walk and Talk social event for the Folkestone Fellas - a community for men in Folkestone and the surrounding areas to make new friends.
SRV048,Tool Library,Folkeshare,,Permanent fixture,FALSE,https://folkeshare.org.uk/,Coming soon,Materials & products,All adults,"save-money, reduce-waste",Community service,FALSE,FALSE,FALSE,FALSE,FALSE,"From power tools and party supplies to kitchen gear, board games, and more, we lend out a wide range of useful items, the kinds of things most people only need occasionally.

We’re also proud to offer a growing collection of film-based photographic equipment, perfect for anyone wanting to explore analog photography without the investment. Whether you’re a seasoned film shooter or a curious beginner, we’ve got you covered."
SRV049,Photography workshops,Folkeshare,,Regular event,FALSE,https://folkeshare.org.uk/skills/,Coming soon,Creative Arts Practice,All adults,new-hobbies,Learning,FALSE,FALSE,FALSE,FALSE,FALSE,"Folkeshare is more than just tools and equipment, we’re a place to grow. Our workshops and classes are shaped by what you want to learn, from bike repair and sewing to photography and home DIY."
SRV050,Go Folkestone Members Meetings,Go Folkestone,,Regular event,TRUE,https://gofolkestone.org.uk/projects/,Check org sites for upcoming dates,Community development,All adults,get-involved,Community organising,FALSE,FALSE,FALSE,FALSE,FALSE,"Go Folkestone isn’t just about preserving the past. It’s about building a future – stronger, greener, and more connected – for everyone who loves this town."
SRV051,Green Gang Tree Planting,Go Folkestone,,Regular event,TRUE,https://gofolkestone.org.uk/projects/,Check org sites for upcoming dates,Nourishing land & nature,All,get-outside,Nature & garden,FALSE,FALSE,FALSE,FALSE,FALSE,"Our Green Gang continues to lead environmental projects that make Folkestone cleaner, greener, and more welcoming. From tree planting to litter-picking, their work is a simple but powerful way of showing what can be achieved when people come together with pride in their town. These activities improve everyday spaces, protect our environment, and build a sense of community ownership."
SRV052,Green Gang Litter Pick,Go Folkestone,,Regular event,TRUE,https://gofolkestone.org.uk/projects/,Check org sites for upcoming dates,Nourishing land & nature,All,get-outside,Nature & garden,FALSE,FALSE,FALSE,FALSE,FALSE,"Our Green Gang continues to lead environmental projects that make Folkestone cleaner, greener, and more welcoming. From tree planting to litter-picking, their work is a simple but powerful way of showing what can be achieved when people come together with pride in their town. These activities improve everyday spaces, protect our environment, and build a sense of community ownership."
SRV053,Folkestone Safe Haven,Mental Health Matters,Folkestone Safe Haven,Permanent fixture,TRUE,https://www.mhm.org.uk/folkestone-safe-haven,6pm-11pm Every day,Emotional wellbeing,All adults,"safe-space, direct-support",Support service,FALSE,FALSE,FALSE,FALSE,FALSE,"Are you feeling distressed, frightened, overwhelmed, or that things are too much for you? Don’t know where to turn to get mental health support? Are your usual sources of support closed for the night?

Folkestone Safe Haven offers out-of-hours mental health support to anyone aged 18+ in the Kent area.

This is a walk-in service - there's no need to be referred by your GP or Care Coordinator. The Folkestone Safe Haven offers a welcoming, safe, comfortable, non-judgmental and non-clinical environment, sometimes known as 'crisis cafes'. At the safe haven, we will be able to provide information and emotional support if you are in crisis or feel you are heading towards a crisis situation."
SRV054,Wellbeing Check-In,South Kent Mind,,Permanent fixture,TRUE,https://southkentmind.org.uk/book-a-wellbeing-check-in,Book a time,Emotional wellbeing,All adults,direct-support,Support service,FALSE,FALSE,FALSE,FALSE,FALSE,"To get involved in South Kent Mind’s activities and services, you will be required to complete a wellbeing check-in with a member of our Wellbeing Team.

These are a 50-minute discussion on how you are currently coping with your mental health and what support would be best for you.

Once a wellbeing check-in has been completed, you will be registered with South Kent Mind and will be able to participate in our activities and services. Wellbeing check-ins are available by contacting us via any of the following ways:"
SRV055,Folkestone Men's Shed,Folkestone Mens Shed;Age UK,Age UK Folkestone - The Marigold Centre,Permanent fixture,TRUE,https://www.facebook.com/folkestonemensshed/,Check org sites for upcoming dates,"Emotional wellbeing, Nourishing land & nature",Retired,"meet-people, new-hobbies",Nature & garden,FALSE,FALSE,FALSE,FALSE,FALSE,"Space for men 55+ to
come together, to meet, share skills
and put the world to rights over a brew"
SRV056,Hythe Community Allotment,The Salus Group;Salus Project,Eaton Lands (South) Allotments,Regular event,TRUE,https://www.facebook.com/SalusYouthShepway/?locale=en_GB,12pm - 3pm Every Tuesday,Nourishing land & nature,All,"free-activities, get-outside, new-hobbies",Nature & garden,FALSE,FALSE,FALSE,FALSE,FALSE,"Give something to our community

Learn practical gardening and DIY skills

Share your skills with others

Or just come and enjoy being outdoors

All ages welcome.

Delivered by Hythe Youth Centre"
SRV057,Hythe Youth Club,The Salus Group;Salus Project,Hythe Youth Centre,Regular event,TRUE,https://www.facebook.com/SalusYouthShepway/?locale=en_GB,"5pm - 8:30pm (Age 8-12 - 5-6:15pm, age 13-19 6:30 - 8:30pm)",Community development,Teenagers,"free-activities, meet-people",Entertainment,FALSE,FALSE,TRUE,FALSE,FALSE,
SRV058,Youth Cafe,The Salus Group;Salus Project,Hythe Youth Centre,Regular event,TRUE,https://www.facebook.com/SalusYouthShepway/?locale=en_GB,10am - 12pm Every Friday,Community development,Teenagers,"direct-support, safe-space",Support service,FALSE,FALSE,TRUE,FALSE,FALSE,"Drop in for support finding work, education, volunteering or training opportunities.

Regular workshops from local employers and agencies to help build employability and life skills.

Or just pop in for a chat."
SRV059,Accessible Nature Walk,Wild With Wheels,,Regular event,TRUE,https://www.eventbrite.co.uk/o/wild-with-wheels-56027938283,Check org sites for upcoming dates,"Physical wellbeing, Emotional wellbeing",All,"free-activities, get-outside",Nature & garden,FALSE,FALSE,FALSE,FALSE,FALSE,"We are fully Inclusive, so welcome all adults and children. We encourage those who are wheelchair and mobility scooter users. Our nature walks are also suitable for people with 

mobility limitations 
chronic illnesses & hidden disabilities
hearing/sight impairments
neurodiverse / learning disabilities
mental health challenges 
emotional and sensory needs
older people
lone new parents
non verbal or ESOL (English for Speakers of Other Language) students"
SRV060,Rethink Carers Support Group,Rethink Mental Illness,The Captains Table Cafe,Regular event,TRUE,https://www.rethink.org/help-in-your-area/support-groups/folkestone-rethink-carers-support-group/,Last Tuesday of the month,Emotional wellbeing,All adults,direct-support,Support service,FALSE,FALSE,FALSE,FALSE,FALSE,We aim to offer a supportive environment to carers as well as some people living with mental illness. We offer a relaxed and friendly space where people can share their problems and learn about organisations and support services that may be able to help them.
SRV061,IPS Employment Services,Rethink Mental Illness,,Permanent fixture,TRUE,https://rethink.org/media/bddj5dt3/east-kent-ips-employment-service-leaflet-sept-24.pdf,Book a time,Employment access,All adults,direct-support,Support service,FALSE,FALSE,FALSE,FALSE,FALSE,"Individual Placement & Support (IPS) employment support helps people with any kind of mental illness to find and sustain paid employment. We do not provide support ro access volunteering or training.

The support is rapid with job searching starting within four weeks, even if a person has been off work for years.

This is individualised, person-centred, trauma-informed and time unlimited."
SRV062,Live Well Kent & Medway,Porchlight;Shaw Trust;NHS;Kent County Council,,Permanent fixture,TRUE,https://livewellkent.org.uk/,Book a time,"Emotional wellbeing, Employment access, Safe & comfortable housing for all",All adults,direct-support,Support service,FALSE,FALSE,FALSE,FALSE,FALSE,"Are your feelings or worries affecting your health, relationships, work or day-to-day life? You’re not alone. Thousands of people in the UK experience mental health issues each year.

If you’re aged 17+ and live in Kent or Medway, our network of voluntary organisations and charities can help you:

- Better manage your mental health and general wellbeing
- Gain confidence and meet new people
- Get advice for money, debt or benefit-related issues
- Get support for housing concerns
- Access free therapy and counselling-type services
- Find work, volunteering and education opportunities
- Join local activities and support groups run by people with similar experiences."
SRV063,BeYou LGBTQ+ Support Meet Ups,Porchlight;NHS,,Regular event,TRUE,https://thebeyouproject.co.uk/meets/,Contact organisation for details,"Emotional wellbeing, Community development",Teenagers,"direct-support, safe-space",Support service,FALSE,FALSE,TRUE,FALSE,FALSE,"If you identify as a young LGBTQ+ person we have a range of support you can access.

Our meet-ups are safe spaces for young people who are LGBTQ+ or think they might be LGBTQ+.

You can meet new people who share some of the same feelings and experiences as you, socialise, and talk in a safe and non-judgemental setting.

It’s also a great way to meet the BeYou team who can give you additional support if you need it.

Meet-ups are held weekly. Some take place in person, others are online."
SRV064,BeYou LGBTQ+ 1-to-1 Support,Porchlight;NHS,,Permanent fixture,TRUE,https://thebeyouproject.co.uk/get-help/,Book a time,Emotional wellbeing,Teenagers,direct-support,Support service,FALSE,FALSE,TRUE,FALSE,FALSE,"If you identify as a young LGBTQ+ person we have a range of support you can access.

Everyone, at times, can find things a little challenging and difficult to manage. You may want to chat with an experienced LGBTQ+ youth support worker.

Sessions are between 30 mins to 1 hour, we do what works for you. They may take place at a youth centre, online or in the community."
SRV065,Folkestone Womens Forum,Folkestone Womens Forum,,Regular event,TRUE,https://folkestonewomensforum.com/folkestone-womens-forum,Contact organisation for details,Community development,All adults,"meet-people, get-involved",Tea & talk,FALSE,FALSE,FALSE,FALSE,FALSE,"Folkestone Women’s Forum is a feminist organization with community, collaboration, and connection at its core. We hold discussions of our interests, work, passions, and experiences. We also support and publicize other events under the FWF umbrella – meet-ups, book discussions, walks, games nights, meals – and encourage you to get involved in organizing these."
SRV066,DadSpace Mental Health Support Group,DadSpace,,Regular event,TRUE,https://www.dadspace.co.uk/dadspace-folkestone,Check org sites for upcoming dates,"Emotional wellbeing, Community development",All adults,"direct-support, meet-people",Support service,FALSE,FALSE,TRUE,FALSE,FALSE,"To provide a safe space for dads to talk, listen and share their experiences of fatherhood."
SRV067,Hythe Electrical Recycling,Hythe Environmental Community Group;The Parish of St Leonards,The Open Door Project,Regular event,TRUE,https://www.facebook.com/groups/1403528403025955,9:30am - 1pm Every Saturday,Zero waste,All,reduce-waste,Community services,FALSE,FALSE,FALSE,FALSE,FALSE,"Hythe ECG in conjunction with “The Open Door Project” is creating a local E-Waste drop off point at 101 Hythe High Street (Launching on 10th December 2022) and hopes to encourage people to bring their small waste electricals into town when they are shopping rather than dropping it in their domestic waste bin. The Drop Off will be manned by volunteers who can also advise on general recycling, promote the work of the Hythe Environmental Group and oversee the Drop Off."
SRV068,Hythe Community Hop Farm,Hythe Environmental Community Group;Grow Beer,,Permanent fixture,TRUE,https://www.facebook.com/groups/4599005866838158,Contact organisation for details,Local sustainable & healthy food,All adults,"new-hobbies, locally-grown",Nature & garden,FALSE,FALSE,FALSE,FALSE,FALSE,"Hythe Hops community hop garden is part of the national Grow Beer movement, We are a voluntary, non-profit group; our members grow hops in their back gardens, allotments, gardens, community gardens and also public spaces."
SRV069,Apple Pressing,Hythe Environmental Community Group,,Seasonal event,TRUE,https://www.facebook.com/groups/1403528403025955,Check org sites for upcoming dates,Local sustainable & healthy food,All,"free-activities, new-hobbies",Nature & garden,FALSE,FALSE,FALSE,FALSE,FALSE,"The group has owned a community fruit press and fruit crusher for a number of years, and have held a number of popular  community apple pressing events held every Autumn in Hythe High Street. The events are a big hit with families as combined fun and education."
SRV070,Plant and Seed Swap,Hythe Environmental Community Group,,Regular event,TRUE,https://www.facebook.com/groups/1403528403025955,Check org sites for upcoming dates,"Local sustainable & healthy food, Festivals and events",All,"locally-grown, meet-people",Nature & garden,FALSE,FALSE,FALSE,FALSE,FALSE,"For many years now we have held a number of events each year (Spring and Autumn, usually) to allow our community (gardeners, allotment holders, anybody) to swap surplus seeds, plants and produce.

These are always held in the Hythe town centre – either under the Town Hall, or on Town Square (on the High Street side of Aldi)"
SRV071,Hythe Community Litter Pick,Hythe Environmental Community Group,,Regular event,TRUE,https://www.facebook.com/groups/1403528403025955,10am - 11:30am Every 1st Saturday of the month,Nourishing land & nature,All,get-outside,Community service,FALSE,FALSE,FALSE,FALSE,FALSE,This Group has a very active band of Litter Pickers in and around Hythe who usually meet on the 1st Saturday of the month.(see “Events” Calendar and our FB Page).
SRV072,Hythe Gleaning Group,Hythe Environmental Community Group,,Seasonal event,TRUE,https://www.facebook.com/groups/1403528403025955,Check org sites for upcoming dates,No food poverty,All,"get-involved, locally-grown, get-outside",Nature & garden,FALSE,FALSE,FALSE,FALSE,FALSE,There are many things that upset us at HECG and one is FOOD WASTE. Gleaning is the act of collecting leftover crops from farmers’ fields after they have been commercially harvested or on fields where it is not economically profitable to harvest.
SRV073,Folkestone Pride Sunday Social,Pride Folkestone,,Regular event,TRUE,https://www.folkestonepride.org/event-details/sunday-social-2026-01-25-14-30,,Community development,All adults,meet-people,Tea & talk,FALSE,FALSE,FALSE,FALSE,FALSE,"Drop in for a friendly LGBTQ+ meetup, enjoy a complimentary hot drink, and connect with new people in a welcoming space."
SRV074,U3A Coffee Mornings - Hythe,Shepway & District U3A,Tin Tabernacle,Regular event,TRUE,https://shepway.u3asite.uk/,11am every 4th Friday of the month,Community development,All adults,meet-people,Tea & talk,FALSE,FALSE,FALSE,FALSE,FALSE,"We have regular monthly coffee mornings on the fourth Friday of the month currently at the Tin Tabernacle, Hythe starting at 11.00 am"
SRV075,U3A Coffee Mornings - Folkestone,Shepway & District U3A,The Clifton Hotel,Regular event,TRUE,https://shepway.u3asite.uk/,10:30am every 3rd Wednesday of the month,Community development,All adults,meet-people,Tea & talk,FALSE,FALSE,FALSE,FALSE,FALSE,"We have regular monthly coffee mornings on the third Wednesday in the month currently at the Clifton Hotel, the Leas, Folkestone, starting at 10.30 am"
SRV076,U3A Coffee Mornings - New Romney,Shepway & District U3A,Ship Hotel,Regular event,TRUE,https://shepway.u3asite.uk/,Quarterly,Community development,All adults,meet-people,Tea & talk,FALSE,FALSE,FALSE,FALSE,FALSE,"We have quarterly coffee mornings at the Ship Hotel, New Romney."
SRV077,Shepway Primary Singers,MASC,Wood Avenue Library,Regular event,TRUE,https://shepwaychoirs.co.uk/shepway-primary-singers/,4:30pm - 5:45pm Every Monday (term time only),"Creative Arts Practice, Community development",Young children,"free-activities, new-hobbies",Creative activities,FALSE,FALSE,TRUE,FALSE,FALSE,"A Community Choir for Children of Primary School Age from Shepway and surrounding area.

We are a choir for EVERYONE. Whether you are in the school choir, used to be, or have never ever sung in a group before, we welcome everyone. We believe that our welcoming attitude and open arms to all singers is what makes us stand out from the crowd. There are no auditions, just come along and enjoy!"
SRV078,Shepway Youth Voices,MASC,Wood Avenue Library,Regular event,TRUE,https://shepwaychoirs.co.uk/shepway-primary-singers/,6pm - 7:15pm Every Monday (term time only),"Creative Arts Practice, Community development",Teenagers,"free-activities, new-hobbies",Creative activities,FALSE,FALSE,TRUE,FALSE,FALSE,"A Community Choir for anyone of Secondary School Age from Shepway and surrounding area.

We are a choir for EVERYONE. Whether you are in the school choir, used to be, or have never ever sung in a group before, we welcome everyone. We believe that our welcoming attitude and open arms to all singers is what makes us stand out from the crowd. There are no auditions, just come along and enjoy!"
SRV079,Shepway Voices,MASC,Folkestone Baptist Church,Regular event,TRUE,https://shepwaychoirs.co.uk/shepway-primary-singers/,7:30pm - 9:30pm Every Wednesday,"Creative Arts Practice, Community development",All adults,"free-activities, new-hobbies",Creative activities,FALSE,FALSE,FALSE,FALSE,FALSE,"A Community Choir for Adults from Shepway and surrounding area.

We are a choir for EVERYONE. Whether you have been in a choir your whole life, or you have never sung in public before, we welcome everyone. We believe that our welcoming attitude and open arms to all singers is what makes us stand out from the crowd. You do not need to be able to read music, and there are no auditions, just come along and enjoy!"
SRV080,Storytime,The Folkestone Bookshop,The Folkestone Bookshop,Regular event,TRUE,https://www.thefolkestonebookshop.co.uk/events-calendar,11:30am - 12:30am Every Thursday,Festivals and events,Babies/toddlers & parents,free-activities,Community services,FALSE,FALSE,TRUE,FALSE,FALSE,"Free storytime with books suitable for babies to 4 years old, plus refreshments for the adults. Featuring occasional guest readers!"
SRV081,Co-writing Group,The Folkestone Bookshop,The Folkestone Bookshop,Regular event,TRUE,https://www.thefolkestonebookshop.co.uk/events-calendar,10am - 12pm Every Sunday,Creative Arts Practice,All,free-activities,Creative activities,FALSE,FALSE,FALSE,FALSE,FALSE,Free drop-in for anyone wanting to make space and time for themselves to write.
SRV082,Thursday Community Lunch,Folkestone Baptist Church,Folkestone Baptist Church,Regular event,TRUE,https://www.folkestonebaptistchurch.org/whatson.html,12pm Every Thursday,No food poverty,All,"save-money, meet-people, free-food",Food service,FALSE,FALSE,FALSE,FALSE,FALSE,Our very popular Community Lunch is served at 12 noon every Thursday. You can enjoy a hot meal freshly cooked by our team on a ‘pay what you can afford’ basis. We’d love to see you.
SRV083,Craft Club,Capel Baptist Church,Capel Baptist Church,Regular event,TRUE,,,Creative Arts Practice,All adults,"free-activities, meet-people",Creative activities,FALSE,FALSE,FALSE,FALSE,FALSE,"First Friday of each month 7.00-9.00pm, all welcome."
SRV084,Weekly Creative Workshops,Treat Me RIght CIC,D:NA,Regular event,TRUE,,10:30am - 12:30pm Every Thursday,Creative Arts Practice,Retired,free-activities,Learning,FALSE,FALSE,FALSE,FALSE,FALSE,"For women and non-binary people 50 and over. Develop ypur creativity, connect with others and make friends along the way."
SRV085,Thrive Business & Career Development Training,Treat Me Right CIC,,Permanent fixture,TRUE,,Coming soon,Employment access,All adults,direct-support,Learning,FALSE,FALSE,FALSE,FALSE,FALSE,
SRV086,Activities for Carers,Care Anchor Kent CIC,,Regular event,TRUE,https://www.facebook.com/CareAnchorKent/events,Check org sites for upcoming dates,Emotional wellbeing,All adults,free-activities,Support service,FALSE,FALSE,FALSE,FALSE,FALSE,"Care Anchor Kent run various activities and meet ups for carers across the Folkestone & Hythe district, including coffee mornings, soundbaths, live entertinment and more - keep up with upcoming dates on Facebook"
SRV087,The Mill Youth Club,South Kent Community Church,The Cornerstone Centre,Regular event,TRUE,https://www.skcc.info/themill,7pm - 8:30pm Every Friday (term time only),Community development,Teenagers,"free-activities, meet-people",Entertainment,FALSE,FALSE,TRUE,FALSE,FALSE,"The Mill is the name of our Youth Club that meets on Friday nights from 7.00 – 8.30 p.m. at The Cornerstone Centre in Folkestone, and is for school years 6 – 13."
SRV088,Cornerstone Drop In,South Kent Community Church,The Cornerstone Centre,Regular event,TRUE,https://www.skcc.info/CornerstoneDropIn,2:30pm - 4:30pm Every Monday & Wednesday,No food poverty,All,"save-money, safe-space",Food service,FALSE,FALSE,FALSE,FALSE,FALSE,"Drop In operates on Mondays and Wednesdays from 2.30 – 4.30 p.m. in the back hall of The Cornerstone Centre, supporting between 20-40 individuals each session. Our dedicated team of volunteers provides a warm, safe and friendly environment for people in our community who are experiencing poverty, social isolation, or homelessness."
SRV089,Christians Against Poverty,South Kent Community Church;Christians Against Poverty,The Cornerstone Centre,Permanent fixture,TRUE,https://www.skcc.info/CAP,Book a time,Safe & equitable place to live & work,All adults,"save-money, direct-support",Support service,FALSE,FALSE,FALSE,FALSE,FALSE,"CAP is a highly reputable and nationally recognised charity that provides practical, professional support to people struggling with debt. SKCC operates a CAP centre for the Shepway area. Under the leadership of Centre Manager Angela Burnett and a dedicated team of trained volunteers, the centre has supported many clients since opening in early 2007. Through CAP's structured debt-management process and ongoing support, clients have experienced significant positive change in their financial circumstances and overall wellbeing."
SRV090,Little Treasures Toddler Group,South Kent Community Church,The Cornerstone Centre,Regular event,TRUE,https://www.skcc.info/littletreasures,9:30am - 11:30am Every Monday,Community development,Babies/toddlers & parents,"free-activities, meet-people",Entertainment,FALSE,FALSE,TRUE,FALSE,FALSE,"Little Treasures Toddler Group runs on Monday mornings (during term time) from 9.30 - 11.30 a.m. at The Cornerstone Centre, Castle Hill Avenue, Folkestone.

There is tea & cake for the grown ups and lots of fun activities for the little ones. 

For further details of all children's activities and planned events please contact the church office on 01303 251155"
SRV091,Baby Basics Folkestone,Baby Basics,,Permanent fixture,TRUE,https://baby-basics.org.uk/centre/folkestone,Referral only,"No food poverty, Safe & equitable place to live & work",Babies/toddlers & parents,"save-money, direct-support",Support service,FALSE,FALSE,TRUE,FALSE,TRUE,"We work closely with over 20 referral agencies including midwives, health visitors, social workers, FHDC welfare and Housing teams as well as other organisations and charities to provide a safe and reliable service that people can trust.

We are open for donations each month.  Items we need are listed on our social media along with the place, date and time to drop off the donations. This list is updated regularly."
