Service ID,Service,Organisation(s),Location(s),Service Type,Free,URL,Timing notes,OnePlanet Cats,Audience Cats,Use Cases,Basic type,Homeless Only,Disability Only,Children/Parents Only,Members Only,Referrals Only,Description
SRV092,Armed Forces Veterans Support Group,Folkestone Nepalese Community,Folkestone Nepalese Community Centre,Regular event,TRUE,https://fncuk.org/armed-forces-veterans-support-group/,10am - 12pm Every second Thursday of the month,"Community development, Safe & equitable place to live & work",All adults,direct-support,Support service,FALSE,FALSE,FALSE,FALSE,FALSE,"Since July 2021, the Folkestone Nepalese Community (FNC) Centre has partnered with Folkestone & Hythe District Council to host regular drop-in sessions. These sessions provide a welcoming space where community members can access advice, guidance, and support."
SRV093,Kent Food Hubs,Kent Food Hubs,Docker Brewery & Taproom,Regular event,FALSE,https://kentfoodhubs.ooooby.org/,3pm - 5pm Every Tuesday,Local sustainable & healthy food,All adults,"spend-local, locally-grown",Food service,FALSE,FALSE,FALSE,FALSE,FALSE,"Join the hub community today!

Kent Food Hubs CIC (Community Interest Company), was set up in January 2020 to provide a platform and a community co-operative for sustainable, ethical and environmentally friendly Growers,Traders, Producers within the Kent area."
SRV094,Evening Walk,Outdoor Folkey,The Leas Bandstand,Regular event,TRUE,https://outdoorfolkey.com/,6pm Every other Wednesday,"Physical wellbeing, Community development",All adults,"free-activities, meet-people, get-outside",Nature & garden,FALSE,FALSE,FALSE,FALSE,FALSE,"Join us Wednesday at 6pm for a relaxed after-work walk along the Leas and the coast.
We’ll meet by the Leas Cliff and stroll for about an hour — a perfect way to get fresh air and connect before the evening sets in.
✨ Everyone’s welcome"
SRV095,Community-Led Outdoor Activities,Outdoor Folkey,,Regular event,TRUE,https://outdoorfolkey.com/,Check org sites for upcoming dates,"Physical wellbeing, Community development",All adults,"free-activities, meet-people, get-outside",Nature & garden,FALSE,FALSE,FALSE,FALSE,FALSE,"Members of the community are encouraged to host their own outdoor activities, which Outdoor Folkey will promote and display on their website and social media. Check their channels for upcoming activities and dates."
SRV096,Hythe Community Bus Service,Kent County Council;Hythe Town Council;Hythe Rotary Club,,Direct support,FALSE,https://www.kent.gov.uk/roads-and-travel/travelling-around-kent/bus-travel/community-transport/set-up-a-community-transport-scheme/hythe-community-bus-service,Book a time,Travel and transport,All,direct-support,Transport,FALSE,FALSE,FALSE,FALSE,FALSE,"Any community group in the Hythe area can apply to hire one or both of the buses. The cost to hire the busses is charged per mile and includes insurance, repairs and replacement."
SRV097,Silent Book Club,Silent Book Club Folkestone,The Board Room,Regular event,TRUE,https://www.instagram.com/silentbookclubfolkes/?hl=en,6:30pm - 8:30pm Every 4th Monday of the month,Emotional wellbeing,All,"new-hobbies, meet-people",Book lovers,FALSE,FALSE,FALSE,FALSE,FALSE,"Bring your own book - no assigned reading. Read together at your own pace - 1 hour of focused, quiet reading time. Introvert-friendly social meetups - no small talk required."